{
  "events": [
    {
      "id": "urn:foi-process:event:sha256:c839e8ca669caf4d0e5a040212842d90c4201edb2b35c0eae5df690dfe791155",
      "event_type": "foio:RequestSent",
      "time": "2025-01-06T09:00:00+13:00",
      "attributes": {
        "native_activity": "request_sent",
        "authority_id": "nz:agency:demo"
      }
    },
    {
      "id": "urn:foi-process:event:sha256:63133db96b2cfc43af6121bdae5c109f243eeb8dd4c2675ffeeb81502be356e4",
      "event_type": "foio:AuthorityResponseReceived",
      "time": "2025-01-07T11:00:00+13:00",
      "attributes": {
        "native_activity": "authority_response",
        "authority_id": "nz:agency:demo"
      }
    },
    {
      "id": "urn:foi-process:event:sha256:c64cef1478af1ff8fcade29f53fe02cd8787f4dabff63777736f3a84dd620ffb",
      "event_type": "foio:ExtensionNotified",
      "time": "2025-01-20T10:15:00+13:00",
      "attributes": {
        "native_activity": "extension",
        "authority_id": "nz:agency:demo"
      }
    },
    {
      "id": "urn:foi-process:event:sha256:7c54702656367adb4a244c447ad61e943feaf71e8b6a64e03d4a0eb36a700cb1",
      "event_type": "foio:ClosedObserved",
      "time": "2025-02-14T16:00:00+13:00",
      "attributes": {
        "native_activity": "closed",
        "authority_id": "nz:agency:demo"
      }
    }
  ],
  "objects": [
    {
      "id": "urn:fyi-nz:request:demo-1",
      "object_type": "foio:Request",
      "attributes": {}
    }
  ],
  "event_object_links": [
    {
      "event_id": "urn:foi-process:event:sha256:c839e8ca669caf4d0e5a040212842d90c4201edb2b35c0eae5df690dfe791155",
      "object_id": "urn:fyi-nz:request:demo-1",
      "qualifier": "foip:case"
    },
    {
      "event_id": "urn:foi-process:event:sha256:63133db96b2cfc43af6121bdae5c109f243eeb8dd4c2675ffeeb81502be356e4",
      "object_id": "urn:fyi-nz:request:demo-1",
      "qualifier": "foip:case"
    },
    {
      "event_id": "urn:foi-process:event:sha256:c64cef1478af1ff8fcade29f53fe02cd8787f4dabff63777736f3a84dd620ffb",
      "object_id": "urn:fyi-nz:request:demo-1",
      "qualifier": "foip:case"
    },
    {
      "event_id": "urn:foi-process:event:sha256:7c54702656367adb4a244c447ad61e943feaf71e8b6a64e03d4a0eb36a700cb1",
      "object_id": "urn:fyi-nz:request:demo-1",
      "qualifier": "foip:case"
    }
  ],
  "object_object_links": [],
  "object_changes": []
}
